{
	"$schema": "../../extensions/sillajje/sillajje-config.schema.json",
	"debug": true,
	"subGeneratorModel": "opencode-go/deepseek-v4-flash",
	"postInit": ["mise trust", "mise deps"],
	"checks": [
		{
			"name": "check",
			"command": "mise run check",
			"triggers": ["settle", "publish"]
		}
	],
	"maxAttempts": 5
}
